start	end	text
0	10480	Hello and welcome to In Control, the first podcast on control theory.
10480	21920	Here we discuss the science of feedback, decision-making, artificial intelligence, and much more.
21920	27280	I'm your host Alberto Padoan, live from our recording studio at ETH Zurich.
27280	31840	Big thanks to our sponsor, the National Center of Competence in Research on Dependable Ubiquitous
31840	36520	Automation, which you can check following the link in the description.
36520	38360	Our guest today is Ben Recht.
38360	43240	Ben is a full professor in the Department of Electrical Engineering and Computer Sciences
43240	46160	at the University of California, Berkeley.
46160	48200	Ben has received a number of awards.
48200	54840	I'm just going to mention that Ben received the NeurIPS Test of Time Award twice.
54840	55840	Welcome to the show, Ben.
56200	57520	Thanks for having me.
57520	64640	So perhaps one nice way to start this podcast is to say that you predicted the existence
64640	66040	of this podcast.
66040	71520	In an IFAC plenary about two years ago, if I'm not wrong, you said this.
71520	76280	And I'm just kind of considering this like an experiment in podcasting because the world
76280	80320	really needs a control theory podcast.
80320	81320	Maybe there is one.
81320	83880	If there is one, I'm happy to participate.
83880	84880	Send me an email.
84920	88440	I'd love to jump on your control theory podcast.
88440	91200	So Ben, you did envision this happening.
91200	93760	So where should I invest my money?
93760	94760	What else can you predict?
94760	98840	Did I predict or did I cause?
98840	102600	I think that's always the tricky question with all of these things, right?
102600	104240	Well, there is a funny anecdote here.
104240	107880	I was absolutely not aware of you mentioning this thing.
107880	113840	I did not participate to that conference, nor did I watch your lecture before somebody
113840	117080	told me in our department.
117080	124040	And then I went on the internet, I found your plenary on YouTube, and I was so pleased to
124040	128040	see that somehow you managed to predict this thing.
128040	130040	Yeah, man.
130040	134520	So Alberto, why did you decide that you, I mean, independently decide that you wanted
134520	136800	to do a control-centric podcast?
136800	142360	Well, you know, there's so many other podcasts out there about artificial intelligence, machine
142360	144880	learning, even soft robotics.
144880	151920	So I guess it's time for us to step up or step out of our academic rooms and maybe talk
151920	154560	about our cool stuff.
154560	155560	Absolutely.
155560	164140	Perhaps a good starting point for our chat today will be about your personal trajectory.
164140	166520	How did it all start?
166520	167520	How early should I go?
167520	168520	As much as you want.
168520	169520	It's a little bit hard, right?
169520	170520	Six months in, if you want.
170520	180080	I mean, I'm having a hard time remembering how I got to my office today.
180080	181080	So it's a lot.
181080	184000	It's trying to dig back into some ancient times.
184000	185000	I don't know.
185000	186000	It's interesting, right?
186000	193960	I think we're in this funny period of recruiting graduate students, and I always like to ask
193960	197920	graduate students why they want to go to graduate school.
198920	200920	I actually stole this one from my wife.
200920	207240	One of the questions I ask them or tell them is, you know, if you could envision yourself
207240	213680	doing anything else other than going to graduate school, you should probably just do that.
213680	215080	I firmly believe that.
215080	219360	I really feel like if you can figure out some other thing that would make you happy and
219360	222480	fulfilled and that, you know, maybe it's risky, maybe it's not.
222480	225760	I still suggest that people do that.
226600	230320	For whatever reason, I wasn't one of those people.
230320	233280	I kind of fell into the going to graduate school thing after college.
233280	234280	I wasn't sure.
234280	239440	I mean, I was always, you know, good in school, but I always had this.
239440	240440	I had a lot of other passions.
240440	246560	I was really into music as a high school kid and college kid, and by the time I got to
246560	249480	my senior year of college, I thought to myself, either I'm going to do one of two things.
249480	257560	I'm either going to go and try to volunteer at all of these recording studios in Chicago
257560	261080	where I was going to undergraduate or I'll go to graduate school.
261080	263160	And then I looked at the graduate schools.
263160	267360	I found one that looked kind of interesting at MIT where they were doing a bunch of weird
267360	268360	stuff.
268360	269560	And it was like, OK, this looks different.
269560	271200	It would be a big change.
271200	272800	They're kind of doing stuff related to music.
272800	273800	I'll just apply there.
273800	275320	And it was very dumb.
275320	277880	Me as a 22 year old, just I had no, I mean, I don't know.
278280	282520	It was not very well thought out process to how I ended up where I am.
282520	288600	But I think it was, it's interesting to go from, you know, I did pure math as an undergraduate.
288600	294800	I decided pretty early on, well, not pretty early on, actually, I remember that when I
294800	300960	decided I couldn't be a mathematician, it was in a class on commutative algebra.
300960	306280	We had done some kind of proof in this class that required six chalkboards and it was just
306320	308480	a diagram drawing all the other chalkboards.
308480	311440	And then I was, I just thought that was one of those wake up and be like, I don't know
311440	313160	what I'm doing with my life days.
313160	316000	And I was like, I can't do this for the rest of my life.
316000	317680	So I kind of just wandered around a lot.
317680	320840	But it was one of those things where if I had, if I had a better idea, I probably would
320840	322840	not be where I am today.
322840	327960	So I ended up at MIT and that kind of changed a lot of my perspectives, going from someplace
327960	330480	very theoretical to someplace very applied.
330840	337880	And so having those, having that big juxtaposition, that big pendulum shift has been something
337880	344160	that has kind of gone on throughout my career, swinging back and forth between just doing
344160	351520	very pure stuff and then trying to get myself into more applied areas, sometimes successful
351520	352640	and sometimes not.
352640	359960	And then bouncing back into theory and also just having a lot of, I don't know what the
359960	364480	right way to put this is, but like the attention span of a gnat, just like not, not being able
364480	368520	to really necessarily focus too long on one thing.
368520	371560	I think this is one of the fun things about being a professor.
371560	373360	Everybody could be a professor in a different way.
373360	378200	There are some people who are going to spend their entire careers, like improving one inequality
378200	381240	because that's the, that's what they care about.
381240	383040	And then I don't know what I'm doing.
383040	384800	I'm just doing the opposite.
384800	388960	I change what I want to work on every, every couple of weeks, maybe.
388960	394520	No, I think that's selling myself a little short, but I do have a hard time spending
394520	398600	more than a few years on a given topic.
398600	403680	And I guess we'll get to this, but I will say right now, not super deep into control
403680	404680	at the moment.
404680	410200	So that was something that, that phase currently is over, but control is something I've gone
410200	413080	back and forth with for my entire career.
413080	414560	So I'm sure I'll come back.
414560	415560	Yeah.
415560	420720	I'm just curious about how did you stumble on control theory?
420720	422360	Yeah.
422360	427800	That was just one of those weird life coincidences, I think I got very lucky.
427800	432480	So I, I mean, I think with a lot of these things, one of the things we underappreciate
432480	437200	about academics in general is just these network connections that kind of take you to where
437200	438200	you go, right?
438200	439200	It's all about people.
439200	444520	It's so much more about people than it is necessarily about particularities of research
444520	447120	problems as to why you end up in a place.
447120	453360	And so when I was pretty early on in graduate school, I went to, I went to a talk by John
453360	460280	Doyle and I just, I, I appreciated his style, which hopefully a lot of people here have
460280	463320	seen at one point or another.
463320	468280	And it ended up talking to him a bunch after the talk with some graduate students.
468280	472080	I always remember he said to me, I like you, you have no tact.
472080	473080	I'll remember that.
473080	474560	I, that's, will stick with me forever.
474560	481320	But yeah, so once I met John, John actually introduced me to Raf D'Andrea, who had been
481320	483400	doing a sabbatical in Boston.
483400	486320	His wife was working at a company in Boston.
486320	487640	Raf was currently at Cornell.
487640	490000	This was before he was at ETH.
490000	493680	And so, and then Raf and I hung out for a bit and yeah, that was kind of how it all
493680	494680	started.
494680	498920	So it was John, then Raf, and then I met a bunch of other people and it was, yeah, that
498920	501640	was my, so again, random connection.
502640	503840	Randomly, John liked me.
503840	507400	I think that was kind of the, that was the beginning.
507400	508400	This is super cool.
508400	514200	I guess also given that you mentioned the influence of John, this is probably also one
514200	519160	of the reasons a posteriori of your interest on robust control and perhaps bridging robust
519160	524440	control to the world of machine learning.
524440	531760	I guess my last question before we pause and move on, let's say to more technical terrain,
531760	535040	is about the people that influenced your research.
535040	540160	So if you had to name three of them, I guess one would be probably John Doyle, as you mentioned.
540160	541160	Definitely John.
541160	542160	Yeah.
542160	543160	But what about the other two then?
543160	547760	It's a great, wow.
547760	549000	Other people who've been influenced by research.
549000	554000	I mean, I think, I think again, the way you want, the way I think about it is not necessarily,
554560	557120	and I probably could dig into this more and think about like, who are the people who I
557120	560320	read who like really changed the way I thought.
560320	564440	But I think a lot of the times it's just who are the people who were there to mentor me
564440	568080	and to kind of lead me in these different directions.
568080	574960	I would say, you know, Steve Wright had a huge impact on my, both on my professional
574960	579240	career and the way I think about optimization.
580240	585520	Steve was really instrumental in recruiting me to Wisconsin, where I was before Berkeley.
585520	592440	And he was just really both a personal mentor and also just taught me so much about the
592440	594640	ins and outs of optimization research.
594640	600320	So I think Steve is another person who really stands out in my head as a real, a huge influence.
600320	607240	Let me think about who else, because this is always tricky.
607240	610240	Because there have been a lot of other people who I've just really enjoyed working with,
610240	615960	like, you know, like Raph for bringing me into control and taking me in those directions.
615960	621400	Pretty soon after I met Raph and John, Pablo Pirillo moved from ETH to MIT.
621400	623680	Look at all these ETH connections.
623680	625680	He moved from ETH to MIT.
625680	630520	And then, you know, I learned so much from Pablo.
630520	635640	Dimitri Burtsekas also at MIT is someone I've talked with a lot about so many different
635640	636920	things at different points.
636920	641680	I think what Dimitri is interesting because I learned convex analysis from him.
641680	644080	That was my first real interaction with him.
644080	651200	And I learned a lot about optimization algorithms, but it wasn't until many years later that
651200	655400	I got into optimal control, reinforcement learning, and Dimitri had done so much work
655400	656400	there.
656400	659520	So it's kind of fun to reconnect with him in that space, because we had done so much
659520	663840	of our chatting had been about optimization, then optimization and machine learning.
663840	667440	But then it kind of looped back to the stuff that he was just the, you know, he was one
667440	671040	of the most important researchers in dynamic programming.
671040	676000	And it just wasn't, you know, it's just funny that we go through these trend cycles.
676000	680640	Dynamic programming wasn't maybe as hot a topic when I was in graduate school, but it
680640	682920	was kind of fun to kind of loop back with him.
682920	686800	I certainly have more Burtsekas books than I think any other person.
686800	690000	This is an interesting trivia.
690000	693160	I mean, he writes so many books.
693160	694160	It's not really fair.
694160	695560	So many good books, I would say.
695560	696840	I mean, they're all excellent.
696840	697840	They're all excellent.
697840	698840	Yeah, yeah.
698840	699840	Oh, absolutely.
699840	702360	But it's just also not, I mean, I don't know how anyone could keep up with that kind of
702360	703360	prolific.
703360	707560	This is so impressive.
707560	708560	And you're right.
708560	711000	Like, it's amazing how many of them are good, right?
711000	716120	I mean, his nonlinear optimization book is just, it's just filled with amazing things.
716120	718880	And he had that classic book on, I mean, it was amazing.
718880	720000	I forgot about that.
720000	725240	He wrote this book on distributed computing with Sitsiklis, I don't even remember when
725240	726720	that book was from.
726720	727720	It's old.
727720	734480	And it kind of came back in the early 2010s was a very, like, everybody was into distributed
734480	735480	machine learning.
735480	739960	It turns out that anything you wanted was almost certainly in that book already.
739960	742600	And so I remember interacting with him a lot about that.
742600	747160	He was a little bit upset, honestly, that like, some people didn't realize that, but
747160	748160	it worked out.
748160	749160	Right.
749320	753440	So it's distributed computing, he had done dynamic programming, he had done all sorts
753440	758640	of stuff on stochastic gradients, just a really impressive person.
758640	765440	And I think there's this, lots of people will write lots of papers, but there's really very
765440	772520	few people who will, can turn a research program into courses, right?
772520	775640	That's a hard jump to take something that is like, this is my research, and I'm going
775640	781000	to turn this into something that I could teach to, you know, first year graduate students.
781000	786480	That's taking cutting edge stuff and turning it into that kind of synthesis is, you know,
786480	787480	really, really hard.
787480	789640	And Dimitri is just incredibly talented at it.
789640	793040	Yeah, this requires incredible mental clarity.
793040	799760	I'll just take this assist that you served me to mention that all the people that you
799760	807360	mentioned before are very welcome in this podcast, as well.
807360	811280	You should, Dimitri would be a fun person to chat with, honestly, I think he would be,
811280	816160	I mean, they're all fun, John always is fun, but I think Dimitri has a lot of very interesting
816160	817160	perspectives.
817160	818720	You should, I should, I'll send a pink tip.
818720	819720	Let's see what we can do.
819720	820720	Yeah.
820720	821720	Yeah.
821720	822720	Yeah.
822720	829040	Okay, so maybe we can move on to, I would probably start with Argamin, your legendary
829920	835760	blog, at least legendary for the underground community of machine learning and control geeks.
837200	841680	You posted a wealth of super interesting blog posts there.
843280	849120	Perhaps if I had to summarize the context of your own enterprise, there would be something like,
849840	853760	in theory, there's no difference between theory and practice, but in practice, there is.
855680	856640	What do you say about this?
857280	858400	I mean, that's certainly true.
859520	862800	The question is, is the gap bigger in theory or practice?
862800	867120	And I actually, I think most of the time we say that the gap is bigger in practice,
867120	869200	but I don't know, it just depends.
869200	873840	I mean, I see some pretty loose bounds, especially in the things I've been working with.
875280	878640	Actually, many times in my career, you see these things where the theory is much more
878640	880400	pessimistic than it need be.
880400	885600	So, you know, it's interesting to see that interplay.
886240	889600	Yeah, no, the blog has been a very fun outlet for me.
890720	897120	Yeah, I guess, you know, busting myths is really your cottage industry somehow.
897120	902000	So I was wondering, what was your favorite myth to be busted?
902000	906320	Or what would you be willing to do like in the future?
906320	909040	What's the ultimate myth to bust?
909600	915040	I think sometimes the ones I've found most interesting were the ones I believed.
916240	918880	Right, where it just completely changes my mind.
920160	924080	Usually, this is going to be something led by a graduate student or a postdoc in the
924080	929280	group, and they just show you something that, or show me something that I just don't, would
929280	931360	never have believed a day before.
932960	936640	I think probably like the, there are probably lots of good examples here.
936640	942720	But a really notable one, and one I've been writing about, again, recently, is there's
942720	947520	this concept in machine learning and statistics of overfitting to data, right?
947520	952240	I mean, where the idea would be that somehow you believe a little bit too much in your
952240	957280	data and are unable to extrapolate out to new data, because you've really, you know,
957280	964560	you've somehow caught on to aberrations and particularities of the data set you have.
964560	968640	So it's a very common thing, and we teach it to our undergraduates, that, you know,
968640	970000	overfitting is a huge problem.
971360	975760	And in particular, the way that we do machine learning causes overfitting.
975760	978480	So what, let me, let me dive into that.
978480	979920	Yeah, let's jump into this.
979920	980480	Absolutely.
980480	981120	Okay.
981120	981440	Yeah.
981440	986960	So what we do in machine learning, just from the beginning of time, it turns out, and I
986960	991280	could talk more about, I could talk more about the history of this, because I've also been
991280	994320	absolutely involved in trying to dig into some of the history.
994320	997840	Feel free to express your own necessities.
997840	999680	Scratch your own itches if you want.
999680	1004000	Yeah, well, so from the beginning of time in machine learning, there was this notion
1004000	1010160	that you would have a data set that you train on, a data set that you evaluate or test on,
1010160	1012080	and then the data in the wild.
1012880	1019840	And so it turns out that this, the earliest we found of this practice goes back to the
1019840	1020880	late 1950s.
1020880	1022880	It's a really old idea.
1023920	1028480	And it's kind of, it's kind of amazing that it was, it was, I mean, a lot of people think
1028480	1030560	of that as an idea that comes from statistics.
1030560	1033360	And it's an idea that comes from machine learning before statistics.
1033360	1034640	It's interesting how early that is.
1034640	1035680	Hashtag today I learned.
1036560	1040160	Well, I mean, I think, I think one thing that I've learned, and something I never appreciated
1040160	1047200	before was, before recently was, you know, that machine learning and statistics are much
1047200	1049440	more contemporary than I think we realize.
1049440	1053520	I think we, a lot of people think statistics is very old, because probability is very old.
1054400	1059440	But statistics is kind of the, you know, the appropriate application of probabilistic thinking
1059440	1062400	to how we interact with the real world.
1062400	1068480	And I think those kinds of real aspects weren't nailed down to the 30s, 1930s, which is just
1068480	1069040	fascinating.
1069040	1075120	I mean, there was work by, you know, notably Ronald Fisher and some of his predecessors
1075440	1079280	and Gossett, who was the guy who invented the t-test.
1079280	1081200	This was done in the 20s or so.
1081200	1085600	But that wasn't really until the 30s, where there was like a real rigorous body of statistics,
1085600	1089040	notably by jersey name and kind of nailed that down.
1089040	1091840	But, and it's kind of crazy to think that that's the 30s.
1091840	1095280	It's like, you would think that that would be the 1830s, but it's the 1930s.
1095280	1099040	It's much, much later than, than I think people appreciate.
1099280	1106480	So machine learning is roughly 1950s, and really was well established by 1960.
1106480	1111440	So it's only a gap of, you know, what are we talking about here, like 25 years, not
1111440	1115440	decades, not sorry, not like, you know, it's insane, centuries, it was really a gap of
1115440	1116320	about 25 years.
1116320	1116800	Yeah.
1116800	1121200	To the full foundation of statistical machine learning, and the full foundation of statistics,
1121200	1122800	they're very intertwined with each other.
1122800	1126800	So I think that's where does machine learning start for you with a perceptron?
1127520	1131520	Um, with the kind of like the understanding of how the perceptron works.
1131520	1132160	Okay.
1132160	1135360	And it's not, it's not just the perceptron, because there are other things that people
1135360	1140480	were experimenting with at the time, lots of different even like model based methods,
1141280	1146000	if you kind of go back to literature, but really just the idea of understanding that
1146000	1150480	there's this, you know, in sample versus out sample performance, I could characterize in
1150480	1152720	sample performance and out of sample performance.
1153520	1159280	And so kind of particular way, this was really, this is late 1950s, through early 1960s was
1159280	1160960	where these ideas really came together.
1160960	1161200	Yeah.
1161200	1165680	And going back to the myth that you actually want to bust here, am I understanding correctly
1165680	1169040	that what you say is that we should overfit?
1169040	1170720	Or we shouldn't be scared to overfit?
1170720	1171040	Or?
1171040	1171280	No.
1172240	1174480	Well, I think it's that we shouldn't be scared to overfit.
1174480	1178640	So one of the things that people kind of thought and statisticians have said this is that if
1178640	1184400	you, you look at what we're doing, where we have, you know, some data set, and some
1185120	1189840	testing set, and we're just always, you know, using the this one data set, and then evaluating
1189840	1194080	on the testing set, and repeating this process, you know, you could construct really weird
1194080	1199920	examples where you essentially overfit to this testing set, and then you get some new
1199920	1202560	data, and you've just done you just do terribly.
1202560	1205600	So there's, there are ways to construct examples where that happens.
1206240	1212080	And in my group, we've done now just hundreds and hundreds of experiments, we're showing
1212080	1213280	that that just doesn't happen.
1214240	1219360	So we've done a lot of reproduction studies where we'll reproduce test sets, trying to
1219360	1223360	be as close as possible to the generating process of the original test set.
1223360	1228080	And we've done this for data sets that like the ImageNet data set, or the squad data set,
1228080	1232560	or a variety of others where we can regenerate these kind of test sets.
1233280	1242800	And we see that you don't there's no overfitting the models that perform the best on the original
1242800	1245760	test set are the ones that perform the best on the new data.
1246640	1248960	So completely goes against what you were told.
1248960	1250720	So you can't How do you explain this?
1253440	1254640	That is a wonderful question.
1257040	1259840	I don't I wish I had a good answer for that.
1259840	1264400	I think that's, to me, I mean, sometimes there's like, we almost expect too much from
1264400	1265040	our theory.
1265040	1265540	Okay.
1265920	1266640	And that's okay.
1268080	1273120	I think there are a variety of there are a variety of explanations.
1273920	1279440	Some of them, some of them are mathematical, and then some of them are just sociological,
1279440	1279940	I think.
1280960	1285120	I think that, you know, we pick problems very carefully in machine learning, such that they're
1285120	1286720	not hurt by overfitting.
1286720	1287840	I think that's part of it.
1287840	1292720	Like we're, the problems that we're looking at tend to be not the not the weird, egregious
1292720	1296160	examples that we come up with as counter examples.
1296720	1297840	So I think that's one part.
1298880	1305120	I think another part is that there are a lot of the analysis that would predict overfitting
1305120	1311440	assume some very pathological behavior in the statistics to happen.
1311440	1315760	And, you know, the way that we actually work, there are a variety of different ways that,
1315760	1322400	you know, if, for example, if predictors kind of are correlated, like they kind of
1322400	1326480	give you correlated answers, you know, the bounds on overfitting get better.
