start	end	text
1326480	1328800	So it looks like you can actually have more models.
1329840	1338240	If you don't really hyper optimize to the test error score, that also can kind of prevent
1338240	1338720	overfitting.
1338720	1340800	So there's a variety of like these little tricks.
1340800	1344000	And maybe each one of those is explains a little piece.
1344800	1345760	But I don't think there is.
1346640	1352880	Right now, I don't have a satisfactory explanation for why we don't actually see this kind of
1352880	1354240	overfitting behavior.
1354240	1357280	I'll say this, though, the reason why I'm not spending too much time worrying about
1357280	1362640	it, because the other thing we observed is that while you see the models that perform
1362640	1368320	really well on the new on the old tests that perform really well, on the newer data, they
1368320	1374720	almost always perform worse on the newer data than they did on the original old data.
1375760	1378160	So now everybody's performing worse.
1378720	1382480	It's not that, you know, so again, it's not that we overfit necessarily.
1382480	1389600	It's just that small changes in the data creation process can create large changes in the actual
1389600	1390720	predictive performance.
1390720	1391520	And that's worrying.
1392160	1393840	That's not really an issue of overfitting.
1393840	1395520	That's just an issue of extrapolation.
1396320	1403200	And it's interesting how sensitive machine learning methods can be to small changes in
1403200	1405120	how data presents itself.
1406080	1408480	There are so many directions that I can take off from here.
1408480	1414080	I mean, well, first of all, I guess the first naive comment on this issue is that it seems
1414080	1421200	to me that this could be an issue of generosity in some way, or like the data that we get
1422000	1428720	or better, the way we build models on the data that we get somehow do not suffer from
1428720	1431520	some sort of generosity problem and vice versa.
1432240	1436560	We may be too sensitive to the data somehow.
1436560	1441840	And so therefore, we get worse errors on new data whenever we get new data.
1442720	1443220	Yeah.
1444320	1446800	Would this be fair to say from your point of view?
1447520	1450080	So I don't claim to have answers for this.
1450080	1451680	So I don't know yet.
1451680	1456640	But I do think there are some things that we don't necessarily consider very frequently
1456640	1463120	in machine learning that we should, which is just that they're all of experimental science
1463120	1465120	kind of suffers from this generalization problem.
1466640	1471040	There are things that you do in a laboratory setting that you can go do out in a clinical
1471040	1474000	setting, and they just don't pan out the way you want them to.
1474800	1475040	Right.
1475040	1479360	I mean, I think this is kind of very, very common in medicine, where you do, you know,
1479360	1482880	you build this drug, it looks really good, you go and deploy it, and it's not quite as
1482880	1483920	good as you want it to be.
1485120	1489920	And this is also true in psychology, where you do a study, and, you know, you do a study
1489920	1495280	on a bunch of college aged males, perhaps, and then you try to see does this apply to,
1495280	1499840	you know, middle aged women, and it doesn't, because that's obviously a huge enough context
1499840	1500800	shift that you see it.
1502320	1508640	So on the one hand, understanding how to deal with those shifts between contexts and
1508640	1513360	populations, from the experimental setting, to the general setting is hugely important.
1513360	1518400	And something very like that, that's something that we're doing a lot of active research on
1519120	1519680	in my group.
1520240	1521520	So that's one thing.
1521520	1526640	I think the warning, though, that's still very troubling, is that in the machine learning
1526640	1529760	context, these data sets don't really look that different.
1529760	1533280	And you see a large difference, the fact that you could have two data sets that kind of
1533280	1537600	look the same, and have a huge difference in performance, really freaks me out about
1537600	1538320	machine learning.
1538320	1541440	Indicating some sort of high sensitivity, somehow.
1541440	1543120	Super high sensitivity, yeah.
1543120	1548000	And what people do in practice, and so we can tell our listeners, you know, the fix
1548000	1550960	for this in practice is constant retraining.
1550960	1552160	And there's a lot of that.
1552160	1556400	Could you explain, like, give an analogy of what that means, maybe, for the audience?
1556400	1562320	So this would be the kind of thing where you constantly look for your, you know, as you
1562320	1568400	have something deployed, you constantly look for errors in your deployed system.
1568400	1572560	And as soon as you see them, or even maybe not if you see them, you're still collecting
1572560	1575120	data, and you use that data to retrain the model.
1575920	1580000	And this is definitely a very commonplace way to get around the sensitivity, and something
1580000	1585200	that's very common in industrial applications of machine learning.
1585200	1588160	You do have to refine the models, you do have to retrain the models.
1588880	1593360	They're very unstable to the ravages of time.
1594000	1599280	Maybe for the control theoretically oriented audience out there, I suppose that we are
1599280	1602240	kind of speaking of robustness in this guys.
1602240	1603600	Am I wrong?
1603600	1604720	Probably, probably.
1604720	1610480	I think one thing that's interesting that is missing, and that changes things pretty
1610480	1612640	dramatically, is feedback.
1613760	1617440	So these predictive things, you know, you're at the whim of the prediction.
1618240	1621120	So you're kind of, you're never able to really course correct.
1621120	1626240	I think one of the fascinating things about control is we know that even with poor prediction,
1626240	1632080	we can have stable and robust behavior by proper design and feedback design, right?
1632080	1636880	And that's one of the more fascinating, underappreciated aspects of control.
1636880	1644960	And you're giving me another assist to shift gears and talk about your excursion into control
1644960	1645840	theory, I suppose.
1645840	1646340	Sure.
1647060	1653700	You've written a fantastic series of blog posts on Argmin about reinforcement learning
1653700	1656900	and its connection to optimal control.
1656900	1661540	And this turned out to be also a fantastic paper on the annual reviews on control.
1661540	1664180	Maybe we can speak about that if you like.
1664180	1665460	Absolutely, absolutely.
1667380	1674180	So summarizing your journey in this area would be impossible in a few seconds.
1674740	1681460	But maybe if it's not too much to ask to you, could you give us a sense of your personal
1681460	1683620	perspective on your journey in control, maybe?
1685380	1685940	Yeah.
1685940	1690020	So this is now, I have to think a little, I have to think back to it.
1690020	1693140	I used to have a good story for how I got into it again.
1693140	1698340	I mean, I'm assuming that what we're talking about is, you know, my recent engagement with
1699380	1700420	reinforcement learning.
1700420	1700660	Yes.
1700660	1706020	Because I've, you know, I had, I did some work on distributed control as a graduate
1706020	1706500	student.
1706500	1708340	I've done some work on system identification.
1709380	1713460	As a postdoc, I go back and forth with control and dynamical systems.
1714500	1717860	I'm trying to remember exactly what got me interested.
1719940	1722420	Because it's been so long, but I'm guessing what happened.
1722420	1724500	I'll just again, this is a little bit of a guess.
1724500	1731460	But I'm just trying to try to put myself back in a 2014 mindset is there were a few
1731460	1732260	things that were afoot.
1732260	1736980	First of all, there was a lot of hype around reinforcement learning in 2014.
1736980	1739460	And it is crazy that that's now eight years ago.
1740020	1741380	That's really wild to me.
1741380	1742020	Yeah.
1742020	1742980	It definitely did not.
1742980	1747860	I don't think it actually ended up paying out the way that people were talking, the
1747860	1751220	way they were talking about it, like self-driving cars in 2020.
1751220	1754500	They were definitely saying that in 2014, and it just didn't happen.
1755300	1759220	And it'd be nice if they could actually, you know, reflect on that.
1759220	1761060	But I think they've moved on to Bitcoin or something.
1761060	1761940	They're onto something new.
1761940	1762500	I don't know.
1762500	1763860	Elon Musk is buying Twitter.
1763860	1764260	I don't know.
1764260	1765140	We're doing other stuff.
1766100	1767060	We're moving on.
1768580	1772660	But I think it would be helpful to have some reflection on why didn't that pay out.
1772660	1774660	We're here also for that purpose.
1774660	1777300	I mean, locomotion was another big one, I suppose.
1777620	1781060	Yeah, so locomotion, I think, came a little bit later.
1781060	1784660	But for me, the big things that were, I think, you know, happening at Berkeley was there
1784660	1786340	was a lot of interest in self-driving cars.
1786900	1789940	And then there were a few really interesting papers that were fusing.
1790580	1796500	I was very interested in this paper by Chelsea Finn and Sergey Levine and Peter Abbeel, Trevor
1796500	1801060	Darrell, that kind of showed that you could like learn these visual, you could do control
1801060	1802500	directly from video.
1802500	1804900	That was a very, very impressive.
1804980	1810180	It's one of the holy grails, I suppose, like merging perception and control in a principled
1810180	1810420	way.
1811140	1814260	This is one of the first to do it in a compelling way, I think.
1814980	1816980	So people were very excited about that.
1816980	1820660	So I think we just started digging in a little bit in the group about, you know, what's going
1820660	1821060	on here.
1821060	1822740	I was like, I know control theory.
1822740	1823700	I know machine learning.
1823700	1824740	I should be able to do this.
1824740	1825700	I think it was something like that.
1827060	1829860	I was like, also, I didn't believe a lot of what people were selling.
1829860	1832020	So we started looking into that.
1832020	1836420	And yeah, it led us down quite a path from there, I think.
1836420	1836900	Yeah.
1836900	1843220	I mean, one of the cool things that ended up happening was that of merging or at least
1843220	1850100	connecting the world of robust control and with that of high dimensional statistics.
1850100	1855940	And I think that was a major achievement from my very humble perspective in the sense that
1857300	1861460	robust control tends to assume that uncertainties are somehow bounded.
1862020	1865780	But we never really explain where those bounds come from.
1865780	1874100	Whereas maybe machine learning can kind of help us in estimating those uncertainties
1874100	1879940	from finite sample statistics, finite sample, finite data, if you want.
1881140	1885380	Would that make sense to you as a short summary of your excursion?
1885380	1886260	No, absolutely.
1887300	1888100	That's part of it.
1888260	1890180	I think definitely there was a...
1891140	1895460	I mean, the other way I'd say that is that machine learning is also very bad about quantifying
1895460	1896740	the uncertainty in its predictions.
1897540	1898180	It's terrible.
1899300	1905860	So it's this kind of thing where if you assume a lot of things about a generative process,
1906420	1911140	if you assume a lot of things about how the data is coming to you, I could give you some
1911140	1913140	kind of uncertainty quantification.
1913140	1916580	But you can never check whether or not those things you're supposed to assume are true.
1917540	1920660	It's actually, I think one of these things that's a little worrying sometimes in machine
1920660	1924180	learning is this reliance on probability.
1925460	1931780	I think, honestly, this is a John Doyle thing that was hammered into me, is that you should
1931780	1933700	never add stochastics until you need to.
1934340	1934820	Okay.
1934820	1936420	Which I think is a very interesting perspective.
1936420	1938020	Don't add stochastics until you need to.
1938580	1939080	And...
1939700	1941220	So when is it that you need to then?
1942340	1943460	That's the hard question.
1944260	1948100	So in machine learning, we don't have any theory without some kind of notion of...
1950740	1951240	Well...
1951620	1954260	A fully deterministic machine learning.
1954260	1957700	So, no, no, there is actually, and this is actually really fascinating.
1957700	1959460	There is a fully deterministic machine learning.
1959460	1960820	We just don't really appreciate it.
1961940	1964180	It's just because it's not accessible.
1964180	1968260	I'll say this, I love my friends who work on this stuff, but it's not very accessible.
1968260	1971460	So there is a notion in machine learning that's called regret.
1972260	1972740	Yes.
1972740	1978100	And regret has this idea that what you will look at is, you know, you'll have some sequence
1978100	1982020	and you'll say, you know, this is the best thing that could have been predicted.
1982020	1987220	The best predictions you could have made about the sequence, somehow, if you were omniscient,
1987220	1989140	or like you saw the whole sequence in advance.
1990500	1994260	And then you compare that to how well your algorithm makes predictions.
1994260	1994500	Okay.
1994500	1998660	So you have something like, if I somehow saw the whole sequence, what would be the best
1998660	2000020	predictor I could build?
2000020	2001620	Which would be funny, right?
2001620	2005300	You're somehow saying, I saw everything that happened, and now you're going to tell me,
2005300	2010180	how could I predict, you know, Tuesday from Monday, given that I've already seen Wednesday,
2010180	2010900	Thursday, Friday.
2010900	2015300	It's a little bit of a confusing setup, but that's a very strong assumption, right?
2015300	2019940	So assuming that you could see all of that future information, what would be the best
2019940	2021540	prediction you could have ever made?
2021540	2022580	And that's deterministic.
2022580	2028180	It only depends on the actual values that you saw Monday, on Tuesday, on Wednesday.
2028180	2029380	There's no distribution.
2029380	2030340	There's no sampling.
2030900	2031620	Nothing like that.
2032260	2039620	I found absolutely interesting the linearization principle, by which you say that if a machine
2039620	2044660	learning algorithm does crazy things when restricted to linear models, it's going to
2044660	2047300	do crazy things on complex nonlinear models too.
2047300	2052660	And I think that if we remove machine learning and just say control, probably we get the
2052660	2054100	same output.
2054100	2055140	I think it's similar.
2055140	2058660	And honestly, Aizerman is kind of like, was a bit of an inspiration for that as well.
2058660	2063940	I mean, I feel like a lot of the, I know Aizerman was talking about feedback with,
2064820	2070900	now we're getting into the weeds of memoryless nonlinearity, but I think that this, we learned
2070900	2077220	a lot about optimization from kind of looking at Aizerman's conjecture.
2077220	2082180	And so I think there is this, that interplay happens everywhere.
2082180	2083540	I think it just happens everywhere.
2083540	2087380	Sometimes you just, you're surprised to see how many insights you can get from linear
2087380	2089220	systems or from linear regression.
2089860	2090500	Absolutely.
2090500	2095540	I'm just going to mention for our audience that Aizerman is very well known for a conjecture,
2096180	2103380	an eponymous conjecture related to the stability of a feedback loop that involves a nonlinearity
2103380	2105060	plus some kind of bounds.
2105060	2107460	You can Google that, probably find it on Wikipedia.
2108020	2108260	Yeah.
2108260	2114740	And touching on this point, I suppose the running example of your whole enterprise in
2114740	2116180	control has been LQR.
2118180	2118900	Better for worse.
2119860	2120900	For better, for worse.
2120900	2121620	Yeah.
2121620	2129300	And it was just so fascinating to see, I mean, how much else can we say about it, at least
2129300	2135860	regarding this somewhat old problem with new eyes, with somebody, with the eyes of someone
2135860	2141300	who has been extensively working also with other communities, such as machine learning.
2141380	2147380	And I guess your main finding in this respect would be that certainty equivalents work.
2148100	2149060	That's a big one.
2149060	2149700	I think, let's see.
2150420	2154420	So yeah, my group did a lot of stuff on LQR.
2156260	2158740	I will say that, like, I love that certainty.
2158740	2162420	Let me come back to certainty equivalence, because I do love that result.
2162420	2168580	But I think the thing that we got the whole group super excited was Nikolai Motny, who's
2168580	2172740	now a faculty member at Penn, visited us as a postdoc.
2173700	2179860	And we had been really trying to figure out how to understand, well, what do you do when
2179860	2183460	you have this kind of bad fit LQR model and you do control?
2183460	2185540	And what's the right way to analyze it?
2185540	2190260	Like, how can you even talk about how to analyze this thing where, you know, you're doing some
2190260	2191700	kind of reinforcement learning?
2191700	2192660	Do I fit the model?
2192660	2193620	Do I do something else?
2194420	2200820	And my students, Sarah Dean, Hori Amania, Stephen Tu, figured out a cool way to, like,
2200820	2205700	kind of quantify the uncertainty when you fit an LQR model to data.
2205700	2208900	And they have really, they've done a lot since on that, too.
2208900	2213460	So they really, but we couldn't figure out what you do with that certainty equivalence.
2213460	2215220	And so we tried a bunch of different ideas.
2216180	2217540	Sorry, not with certainty equivalence.
2217540	2218020	Apologies.
2218020	2218660	Let me step back.
2218660	2221460	What do you do with that uncertainty quantification, right?
2222180	2227460	And so now you have this thing where I have a linear system with uncertain parameters,
2227460	2230900	and we tried to use a bunch of different ideas from robust control.
2231700	2235140	And we kept running into walls in the analyses.
2236180	2240900	You know, we worked, we were talking a lot with Andy Packard, and we had a lot of interesting
2240900	2244660	ideas, like mu synthesis related ideas that maybe could have worked.
2244660	2246180	There's a lot of the stuff that could have worked.
2246180	2250820	But what was mind blowing is, you know, Nikolai came and within two weeks, he applied this
2250820	2254500	stuff that he had been working on, which he calls system level synthesis.
2254500	2261060	And yeah, within two weeks, we had amazing theorems that showed that how to do it.
2261060	2267860	You know, we could quantify how many samples you needed to do robust control of a system
2267860	2272980	where you have a, you know, you want to do quadratic LQR, you want to minimize the quadratic
2272980	2275220	cost, you have uncertain linear dynamics.
2275220	2279700	And we could quantify how many samples you needed to get an uncertainty quantification
2279700	2284420	of the system that was good enough to do near optimal control.
2284420	2286020	Really fascinating result.
2286660	2291140	Maybe we can step back here just to help the audience a little bit and just mention what
2291140	2292340	is SLS.
2292340	2293700	I am aware of what that is.
2294340	2300980	But maybe you can help me with an analogy for the audience, like to explain what that
2300980	2302180	does and what it means.
2302900	2309540	Yeah, so system level synthesis, I think there are multiple ways to kind of think about what
2309540	2315940	that, how we approach that problem, or how we approach thinking about that problem.
2317060	2320740	And I'm trying to think what's the best one that the control theoretic audience will
2320740	2321620	respond to.
2321620	2324660	I mean, as always is the case of control, people are going to say, oh, we did it this
2324660	2325700	way in the 80s.
2325700	2327060	Oh, we did this way in the 60s.
2327060	2329140	I don't want to necessarily step on anyone's toes.
2329140	2336260	Let me just explain roughly what this is thinking is you can think about most of the internal
2336260	2340820	maps in control systems as mapping from a disturbance, which consists of your initial
2340820	2346020	state and the actual disturbance signal to either the state.
2347140	2350740	Controller also is just a map from the disturbance to the control.
2351620	2355380	And system level synthesis works directly with those maps, the map that maps disturbance
2355380	2357620	to state, the one that maps disturbance to control.
2358900	2366020	And just gives you a very straightforward linear algebraic approach to doing
2366020	2370500	control synthesis where you're working with these abstract maps rather than working with
2372740	2375940	the actual parameters A, B, and C that you would have in a linear system.
2375940	2377140	Now, why is that better?
2377700	2382100	It's just this, in effect, lifts everything into a higher dimensional space where everything
2382100	2383140	becomes nice.
2383140	2387700	Problems that weren't convex become convex, which is why we find it really useful.
2388900	2390580	Why is this the right mapping?
2390580	2391060	I don't know.
2392180	2392900	I don't know.
2392980	2398660	I think another way to think about it, if you're working in finite time, is that the
2398660	2402100	map from disturbance to state is going to be something like Toplitz matrix with a bunch
2402100	2403140	of parameters in it.
2403140	2406260	And you just have to understand that those parameters can't be arbitrary.
2406260	2408260	They're going to have some relationship.
2408260	2410100	Essentially a finite impulse response.
2410100	2410420	Yeah.
2410420	2415140	And so it's working with those impulse responses and putting these things together in a very
2415140	2415940	clean fashion.
2415940	2418260	So it's surprisingly powerful.
2418260	2420900	And these ideas do appear in other places.
2420900	2425220	I believe in model predictive control, this is called disturbance feedback.
2425220	2426260	I think that's the name.
2426260	2431380	There's definitely something where you operate with this map that maps the error disturbance
2431380	2434100	into your state and the error disturbance into your controller.
2434100	2438500	So yeah, that's the high level.
2438500	2441620	I always feel like it's almost the thing that's funny about it.
2441620	2442180	I love it.
2442180	2443940	I think it's very easy to work with.
2443940	2445940	I could probably teach people how to operate with it.
2446500	2451460	But it kind of led to the second thing, which came a little bit later, which was work by
2451460	2457540	Jorge Amania and Steven Tu, which I think it was kind of, it's not surprising, but this
2457540	2460980	is one of these wonderful things where theory and practice collide.
2460980	2465220	So what we saw with the SLS is that when you have very little data, you did need to have
2465220	2469460	some kind of quantification of the uncertainty in order to get stable performance.
2470260	2474420	But as you start to just get a reasonable amount of data, not too much, just a reasonable
2474420	2479540	amount of data, what you could just do is fit the model using least squares and then
2479540	2485140	plug the model in as if it was true and run your optimal controller with this estimated
2485140	2487140	model as if the estimated model was true.
2487780	2488020	Right?
2488020	2493620	So this is the, whenever I say, as if the estimated model was true, or as if the estimated
2493620	2496580	X was true, we tend to call that certainty equivalence, right?
2496580	2499780	It's assuming a certain level of uncertainty is not there.
2499780	2501140	This is the certainty equivalent model.
2501140	2502980	Assuming there was no noise, this would be what the-
2502980	2505140	Optimism in the face of uncertainty.
2505140	2507780	It's a form of, well, that's interesting.
2508500	2511860	Optimism in the face of uncertainty is a little bit more aggressive than certainty equivalence.
2513060	2514660	Optimism in the face of uncertainty.
2514660	2516340	So essentially these three things are different.
2516340	2520660	So the robust control view is you assume you have data, there's going to be a bunch of
2520660	2522420	models consistent with your data.
2522420	2526020	And you're saying, I'm going to pick the one, the robust control view is I'm going to pick
2526020	2530020	the model that's consistent with my data, but would give me the worst performance.
2530020	2531380	That's robust control.
2531380	2533140	Very pessimistic, right?
2533140	2536020	And they're going to say, well, given that, then what, how do we do design?
2537140	2539780	Certain equivalence just says, I'm going to ignore the uncertainty.
2540340	2541380	Just pretend it's not there.
2541380	2542100	And then what would I do?
2543460	2547300	Optimism in the face of uncertainty says, given all of the models that are consistent
2547300	2550340	with my data, I'm going to pick the one that gives me the best performance.
2551140	2551380	Okay.
2551940	2553540	Which is incredibly aggressive.
2553540	2558580	And the idea there is you, you, you, you know, either you're right, in which case, great,
2559220	2560260	or you're wrong.
2560260	2561380	And you learn that quickly.
2561380	2564980	That's a nice way to put it.
2564980	2566340	Yeah, that's the idea.
